{"acceptance_checks":{"adjacent_gate_only":true,"all_downstream_gates_locked":true,"bounded_live_read_only_soak_passed":true,"live_inputs_content_addressed":true,"malformed_input_rejection_proven":true,"no_execution_surface_introduced":true,"read_only_interfaces_only":true,"replayable_snapshots_retained":true,"rollback_to_simulation_proven":true,"source_outage_behavior_proven":true,"stale_input_rejection_proven":true,"zero_write_capable_secrets":true},"artifact_id":"dad8c960565f7f29a85f542319db900ef57724543811f0f5dca1e178781933b5","artifact_is_command":false,"artifact_type":"GateDescentProposal","authority":false,"connector_mode":"read_only","contract_version":"eve_q_gate_descent_v0.1","created_at":"2026-08-05T04:20:00Z","evidence":[{"evidence_type":"baseline_soak","notes":"Canonical lineage anchor for the 100-cycle deterministic simulation baseline.","sha256":"aa8d222c65158e6077ca05b7ebad33df0778acb56f5ea2e70fb4dd50d0cccb6b","uri":"repo://docs/testing/results/EVE_Q_SOAK_RESULT_20260711T202544Z.json"},{"evidence_type":"live_read_only_soak","notes":"Fixed-count Sepolia campaign: 25 accepted and replayed, zero authority transitions.","sha256":"2f95d2b027ab72c06670645a1204a86517c6657d5edac22fe8c008018a389393","uri":"artifact://gate1a/sepolia-soak/summary"},{"evidence_type":"rollback_test","notes":"Canonical rollback receipt restoring SIMULATION_ONLY.","sha256":"7c33eefc8f6d2331553853dfe8e57c346d87cf64369008ee8c98c0f34c936ba9","uri":"repo://examples/governance/gate1_closure_rollback_receipt_v0_1.json"},{"evidence_type":"threat_model","notes":"Consolidated Gate 1A threat model and residual-risk record.","sha256":"fe9beccfe7d9028b5b872b9ee4ac6131832a348f3eaa68b2489dc0b5536d3f78","uri":"repo://examples/governance/gate1_closure_threat_model_v0_1.json"},{"evidence_type":"contract_lineage","notes":"Ordered merge lineage through source-consensus evidence.","sha256":"ec67290832164d2f600570a4fdeafe5f718bf797e89f7bfa75dea2ee7a545f20","uri":"repo://docs/governance/EVE_Q_GATE1_CLOSURE_THREAT_MODEL_v0_1.md#lineage"},{"evidence_type":"other","notes":"Offline conflict and false-consensus refusal evidence.","sha256":"318edd37964505a52eaa7e56c6d049dbbe434ac362e00d513ccd226b4a6f59a0","uri":"repo://docs/alpha/GATE1_SOURCE_CONSENSUS_EVIDENCE_v0_1.md"}],"expires_at":"2026-08-06T04:20:00Z","gate_states":[{"index":0,"name":"SIMULATION_ONLY","status":"ACTIVE"},{"index":1,"name":"LIVE_READ_ONLY_TELEMETRY","status":"REQUESTED"},{"index":2,"name":"LIVE_PROPOSAL_GENERATION","status":"LOCKED"},{"index":3,"name":"TESTNET_MANUAL_EXTERNAL","status":"LOCKED"},{"index":4,"name":"CAPPED_MANUAL_EXTERNAL","status":"LOCKED"},{"index":5,"name":"EXECUTION_ASSISTANCE","status":"LOCKED"},{"index":6,"name":"NARROW_AUTOMATION","status":"LOCKED"}],"human_promotion_required":true,"may_execute":false,"may_move_capital":false,"prohibited_actions":["capital_movement","multi_gate_descent","order_submission","self_promotion","signing","transaction_broadcast","transaction_construction","wallet_access"],"promotion_eligible":true,"readiness":"READY_FOR_HUMAN_REVIEW","rollback":{"plan_sha256":"30dfadb82a2e78379eecf676e6ae6ec588394c825649b418148f99ccec2591b8","target_gate":0,"test_receipt_sha256":"7c33eefc8f6d2331553853dfe8e57c346d87cf64369008ee8c98c0f34c936ba9","tested":true},"transition":{"current_gate":0,"downstream_inheritance":false,"one_gate_only":true,"requested_gate":1},"ttl_seconds":86400,"write_capable_secrets_present":false}
